<?xml version="1.0" encoding="UTF-8" ?>

<!--

WARNING: THIS FILE IS DEPRECATED.

PLEASE USE THE JSON DATA INSTEAD.

Usually, this data can be found in /usr/share/iso-codes/json.

This file gives a list of all country subdivisions in the ISO 3166-2
standard, and is used to provide translations via gettext

The following conventions are used in this file:
If the standard lists a subdivision name in more than one language
and/or romanization system, only the first listed name is shown.

For some countries the standard also lists a second level of
regional divisions (e.g. for BE, FR, GB, IT, etc.). The codes
for these regional divisions are shown as 'XX YYYY', i.e. with a
space character instead of the '-'.

Copyright (C) 2004-2006 Alastair McKinstry <mckinstry@computer.org>
Copyright (C) 2004, 2007 Christian Perrier <bubulle@debian.org>
Copyright (C) 2005-2007 Tobias Quathamer <toddy@debian.org>
Copyright (C) 2007, 2009 LI Daobing <lidaobing@gmail.com>
Copyright (C) 2007-2010 Alexis Darrasse <alexis@ortsa.com>

    This file is free software; you can redistribute it and/or
    modify it under the terms of the GNU Lesser General Public
    License as published by the Free Software Foundation; either
    version 2.1 of the License, or (at your option) any later version.

    This file is distributed in the hope that it will be useful,
    but WITHOUT ANY WARRANTY; without even the implied warranty of
    MERCHANTABILITY or FITNESS FOR A PARTICULAR PURPOSE.  See the GNU
    Lesser General Public License for more details.

    You should have received a copy of the GNU Lesser General Public
    License along with this program.
    If not, see https://www.gnu.org/licenses/.

Source: <http://www.iso.org/iso/country_codes/background_on_iso_3166/iso_3166-2.htm>
-->


<!DOCTYPE iso_3166_2_entries [
	<!ELEMENT iso_3166_2_entries (iso_3166_country+)>
  <!ELEMENT iso_3166_country (iso_3166_subset*)>
	<!ATTLIST iso_3166_country
		code			CDATA	#REQUIRED
	>
	<!ELEMENT iso_3166_subset (iso_3166_2_entry+)>
	<!ATTLIST iso_3166_subset
		type			CDATA	#REQUIRED
	>
	<!ELEMENT iso_3166_2_entry EMPTY>
	<!ATTLIST iso_3166_2_entry
		code			CDATA	#REQUIRED
		name			CDATA	#REQUIRED
		parent			CDATA	#IMPLIED
	>
]>

<iso_3166_2_entries>
<iso_3166_country code="AD">
<iso_3166_subset type="Parish">
	<iso_3166_2_entry
		code="AD-02"	name="Canillo" />
	<iso_3166_2_entry
		code="AD-03"	name="Encamp" />
	<iso_3166_2_entry
		code="AD-04"	name="La Massana" />
	<iso_3166_2_entry
		code="AD-05"	name="Ordino" />
	<iso_3166_2_entry
		code="AD-06"	name="Sant Julià de Lòria" />
	<iso_3166_2_entry
		code="AD-07"	name="Andorra la Vella" />
	<iso_3166_2_entry
		code="AD-08"	name="Escaldes-Engordany" />
</iso_3166_subset>
</iso_3166_country>
<iso_3166_country code="AE">
<iso_3166_subset type="Emirate">
	<iso_3166_2_entry
		code="AE-AJ"	name="‘Ajmān" />
	<iso_3166_2_entry
		code="AE-AZ"	name="Abū Z̧aby" />
	<iso_3166_2_entry
		code="AE-DU"	name="Dubayy" />
	<iso_3166_2_entry
		code="AE-FU"	name="Al Fujayrah" />
	<iso_3166_2_entry
		code="AE-RK"	name="Ra’s al Khaymah" />
	<iso_3166_2_entry
		code="AE-SH"	name="Ash Shāriqah" />
	<iso_3166_2_entry
		code="AE-UQ"	name="Umm al Qaywayn" />
</iso_3166_subset>
</iso_3166_country>
<iso_3166_country code="AF">
<iso_3166_subset type="Province">
	<iso_3166_2_entry
		code="AF-BAL"	name="Balkh" />
	<iso_3166_2_entry
		code="AF-BAM"	name="Bāmyān" />
	<iso_3166_2_entry
		code="AF-BDG"	name="Bādghīs" />
	<iso_3166_2_entry
		code="AF-BDS"	name="Badakhshān" />
	<iso_3166_2_entry
		code="AF-BGL"	name="Baghlān" />
	<iso_3166_2_entry
		code="AF-DAY"	name="Dāykundī" />
	<iso_3166_2_entry
		code="AF-FRA"	name="Farāh" />
	<iso_3166_2_entry
		code="AF-FYB"	name="Fāryāb" />
	<iso_3166_2_entry
		code="AF-GHA"	name="Ghaznī" />
	<iso_3166_2_entry
		code="AF-GHO"	name="Ghōr" />
	<iso_3166_2_entry
		code="AF-HEL"	name="Helmand" />
	<iso_3166_2_entry
		code="AF-HER"	name="Herāt" />
	<iso_3166_2_entry
		code="AF-JOW"	name="Jowzjān" />
	<iso_3166_2_entry
		code="AF-KAB"	name="Kābul" />
	<iso_3166_2_entry
		code="AF-KAN"	name="Kandahār" />
	<iso_3166_2_entry
		code="AF-KAP"	name="Kāpīsā" />
	<iso_3166_2_entry
		code="AF-KDZ"	name="Kunduz" />
	<iso_3166_2_entry
		code="AF-KHO"	name="Khōst" />
	<iso_3166_2_entry
		code="AF-KNR"	name="Kunaṟ" />
	<iso_3166_2_entry
		code="AF-LAG"	name="Laghmān" />
	<iso_3166_2_entry
		code="AF-LOG"	name="Lōgar" />
	<iso_3166_2_entry
		code="AF-NAN"	name="Nangarhār" />
	<iso_3166_2_entry
		code="AF-NIM"	name="Nīmrōz" />
	<iso_3166_2_entry
		code="AF-NUR"	name="Nūristān" />
	<iso_3166_2_entry
		code="AF-PAN"	name="Panjshayr" />
	<iso_3166_2_entry
		code="AF-PAR"	name="Parwān" />
	<iso_3166_2_entry
		code="AF-PIA"	name="Paktiyā" />
	<iso_3166_2_entry
		code="AF-PKA"	name="Paktīkā" />
	<iso_3166_2_entry
		code="AF-SAM"	name="Samangān" />
	<iso_3166_2_entry
		code="AF-SAR"	name="Sar-e Pul" />
	<iso_3166_2_entry
		code="AF-TAK"	name="Takhār" />
	<iso_3166_2_entry
		code="AF-URU"	name="Uruzgān" />
	<iso_3166_2_entry
		code="AF-WAR"	name="Wardak" />
	<iso_3166_2_entry
		code="AF-ZAB"	name="Zābul" />
</iso_3166_subset>
</iso_3166_country>
<iso_3166_country code="AG">
<iso_3166_subset type="Dependency">
	<iso_3166_2_entry
		code="AG-10"	name="Barbuda" />
	<iso_3166_2_entry
		code="AG-11"	name="Redonda" />
</iso_3166_subset>
<iso_3166_subset type="Parish">
	<iso_3166_2_entry
		code="AG-03"	name="Saint George" />
	<iso_3166_2_entry
		code="AG-04"	name="Saint John" />
	<iso_3166_2_entry
		code="AG-05"	name="Saint Mary" />
	<iso_3166_2_entry
		code="AG-06"	name="Saint Paul" />
	<iso_3166_2_entry
		code="AG-07"	name="Saint Peter" />
	<iso_3166_2_entry
		code="AG-08"	name="Saint Philip" />
</iso_3166_subset>
</iso_3166_country>
<iso_3166_country code="AL">
<iso_3166_subset type="County">
	<iso_3166_2_entry
		code="AL-01"	name="Berat" />
	<iso_3166_2_entry
		code="AL-02"	name="Durrës" />
	<iso_3166_2_entry
		code="AL-03"	name="Elbasan" />
	<iso_3166_2_entry
		code="AL-04"	name="Fier" />
	<iso_3166_2_entry
		code="AL-05"	name="Gjirokastër" />
	<iso_3166_2_entry
		code="AL-06"	name="Korçë" />
	<iso_3166_2_entry
		code="AL-07"	name="Kukës" />
	<iso_3166_2_entry
		code="AL-08"	name="Lezhë" />
	<iso_3166_2_entry
		code="AL-09"	name="Dibër" />
	<iso_3166_2_entry
		code="AL-10"	name="Shkodër" />
	<iso_3166_2_entry
		code="AL-11"	name="Tiranë" />
	<iso_3166_2_entry
		code="AL-12"	name="Vlorë" />
</iso_3166_subset>
</iso_3166_country>
<iso_3166_country code="AM">
<iso_3166_subset type="City">
	<iso_3166_2_entry
		code="AM-ER"	name="Erevan" />
</iso_3166_subset>
<iso_3166_subset type="Region">
	<iso_3166_2_entry
		code="AM-AG"	name="Aragac̣otn" />
	<iso_3166_2_entry
		code="AM-AR"	name="Ararat" />
	<iso_3166_2_entry
		code="AM-AV"	name="Armavir" />
	<iso_3166_2_entry
		code="AM-GR"	name="Geġark'unik'" />
	<iso_3166_2_entry
		code="AM-KT"	name="Kotayk'" />
	<iso_3166_2_entry
		code="AM-LO"	name="Loṙi" />
	<iso_3166_2_entry
		code="AM-SH"	name="Širak" />
	<iso_3166_2_entry
		code="AM-SU"	name="Syunik'" />
	<iso_3166_2_entry
		code="AM-TV"	name="Tavuš" />
	<iso_3166_2_entry
		code="AM-VD"	name="Vayoć Jor" />
</iso_3166_subset>
</iso_3166_country>
<iso_3166_country code="AO">
<iso_3166_subset type="Province">
	<iso_3166_2_entry
		code="AO-BGO"	name="Bengo" />
	<iso_3166_2_entry
		code="AO-BGU"	name="Benguela" />
	<iso_3166_2_entry
		code="AO-BIE"	name="Bié" />
	<iso_3166_2_entry
		code="AO-CAB"	name="Cabinda" />
	<iso_3166_2_entry
		code="AO-CCU"	name="Cuando Cubango" />
	<iso_3166_2_entry
		code="AO-CNN"	name="Cunene" />
	<iso_3166_2_entry
		code="AO-CNO"	name="Cuanza-Norte" />
	<iso_3166_2_entry
		code="AO-CUS"	name="Cuanza-Sul" />
	<iso_3166_2_entry
		code="AO-HUA"	name="Huambo" />
	<iso_3166_2_entry
		code="AO-HUI"	name="Huíla" />
	<iso_3166_2_entry
		code="AO-LNO"	name="Lunda-Norte" />
	<iso_3166_2_entry
		code="AO-LSU"	name="Lunda-Sul" />
	<iso_3166_2_entry
		code="AO-LUA"	name="Luanda" />
	<iso_3166_2_entry
		code="AO-MAL"	name="Malange" />
	<iso_3166_2_entry
		code="AO-MOX"	name="Moxico" />
	<iso_3166_2_entry
		code="AO-NAM"	name="Namibe" />
	<iso_3166_2_entry
		code="AO-UIG"	name="Uíge" />
	<iso_3166_2_entry
		code="AO-ZAI"	name="Zaire" />
</iso_3166_subset>
</iso_3166_country>
<iso_3166_country code="AR">
<iso_3166_subset type="City">
	<iso_3166_2_entry
		code="AR-C"	name="Ciudad Autónoma de Buenos Aires" />
</iso_3166_subset>
<iso_3166_subset type="Province">
	<iso_3166_2_entry
		code="AR-A"	name="Salta" />
	<iso_3166_2_entry
		code="AR-B"	name="Buenos Aires" />
	<iso_3166_2_entry
		code="AR-D"	name="San Luis" />
	<iso_3166_2_entry
		code="AR-E"	name="Entre Ríos" />
	<iso_3166_2_entry
		code="AR-F"	name="La Rioja" />
	<iso_3166_2_entry
		code="AR-G"	name="Santiago del Estero" />
	<iso_3166_2_entry
		code="AR-H"	name="Chaco" />
	<iso_3166_2_entry
		code="AR-J"	name="San Juan" />
	<iso_3166_2_entry
		code="AR-K"	name="Catamarca" />
	<iso_3166_2_entry
		code="AR-L"	name="La Pampa" />
	<iso_3166_2_entry
		code="AR-M"	name="Mendoza" />
	<iso_3166_2_entry
		code="AR-N"	name="Misiones" />
	<iso_3166_2_entry
		code="AR-P"	name="Formosa" />
	<iso_3166_2_entry
		code="AR-Q"	name="Neuquén" />
	<iso_3166_2_entry
		code="AR-R"	name="Río Negro" />
	<iso_3166_2_entry
		code="AR-S"	name="Santa Fe" />
	<iso_3166_2_entry
		code="AR-T"	name="Tucumán" />
	<iso_3166_2_entry
		code="AR-U"	name="Chubut" />
	<iso_3166_2_entry
		code="AR-V"	name="Tierra del Fuego" />
	<iso_3166_2_entry
		code="AR-W"	name="Corrientes" />
	<iso_3166_2_entry
		code="AR-X"	name="Córdoba" />
	<iso_3166_2_entry
		code="AR-Y"	name="Jujuy" />
	<iso_3166_2_entry
		code="AR-Z"	name="Santa Cruz" />
</iso_3166_subset>
</iso_3166_country>
<iso_3166_country code="AT">
<iso_3166_subset type="State">
	<iso_3166_2_entry
		code="AT-1"	name="Burgenland" />
	<iso_3166_2_entry
		code="AT-2"	name="Kärnten" />
	<iso_3166_2_entry
		code="AT-3"	name="Niederösterreich" />
	<iso_3166_2_entry
		code="AT-4"	name="Oberösterreich" />
	<iso_3166_2_entry
		code="AT-5"	name="Salzburg" />
	<iso_3166_2_entry
		code="AT-6"	name="Steiermark" />
	<iso_3166_2_entry
		code="AT-7"	name="Tirol" />
	<iso_3166_2_entry
		code="AT-8"	name="Vorarlberg" />
	<iso_3166_2_entry
		code="AT-9"	name="Wien" />
</iso_3166_subset>
</iso_3166_country>
<iso_3166_country code="AU">
<iso_3166_subset type="State">
	<iso_3166_2_entry
		code="AU-NSW"	name="New South Wales" />
	<iso_3166_2_entry
		code="AU-QLD"	name="Queensland" />
	<iso_3166_2_entry
		code="AU-SA"	name="South Australia" />
	<iso_3166_2_entry
		code="AU-TAS"	name="Tasmania" />
	<iso_3166_2_entry
		code="AU-VIC"	name="Victoria" />
	<iso_3166_2_entry
		code="AU-WA"	name="Western Australia" />
</iso_3166_subset>
<iso_3166_subset type="Territory">
	<iso_3166_2_entry
		code="AU-ACT"	name="Australian Capital Territory" />
	<iso_3166_2_entry
		code="AU-NT"	name="Northern Territory" />
</iso_3166_subset>
</iso_3166_country>
<iso_3166_country code="AZ">
<iso_3166_subset type="Autonomous republic">
	<iso_3166_2_entry
		code="AZ-NX"	name="Naxçıvan" />
</iso_3166_subset>
<iso_3166_subset type="Municipality">
	<iso_3166_2_entry
		code="AZ-BA"	name="Bakı" />
	<iso_3166_2_entry
		code="AZ-GA"	name="Gəncə" />
	<iso_3166_2_entry
		code="AZ-LA"	name="Lənkəran" />
	<iso_3166_2_entry
		code="AZ-MI"	name="Mingəçevir" />
	<iso_3166_2_entry
		code="AZ-NA"	name="Naftalan" />
	<iso_3166_2_entry
		code="AZ-NV"	name="Naxçıvan"	parent="AZ-NX" />
	<iso_3166_2_entry
		code="AZ-SA"	name="Şəki" />
	<iso_3166_2_entry
		code="AZ-SM"	name="Sumqayıt" />
	<iso_3166_2_entry
		code="AZ-SR"	name="Şirvan" />
	<iso_3166_2_entry
		code="AZ-XA"	name="Xankəndi" />
	<iso_3166_2_entry
		code="AZ-YE"	name="Yevlax" />
</iso_3166_subset>
<iso_3166_subset type="Rayon">
	<iso_3166_2_entry
		code="AZ-ABS"	name="Abşeron" />
	<iso_3166_2_entry
		code="AZ-AGA"	name="Ağstafa" />
	<iso_3166_2_entry
		code="AZ-AGC"	name="Ağcabədi" />
	<iso_3166_2_entry
		code="AZ-AGM"	name="Ağdam" />
	<iso_3166_2_entry
		code="AZ-AGS"	name="Ağdaş" />
	<iso_3166_2_entry
		code="AZ-AGU"	name="Ağsu" />
	<iso_3166_2_entry
		code="AZ-AST"	name="Astara" />
	<iso_3166_2_entry
		code="AZ-BAB"	name="Babək"	parent="AZ-NX" />
	<iso_3166_2_entry
		code="AZ-BAL"	name="Balakən" />
	<iso_3166_2_entry
		code="AZ-BAR"	name="Bərdə" />
	<iso_3166_2_entry
		code="AZ-BEY"	name="Beyləqan" />
	<iso_3166_2_entry
		code="AZ-BIL"	name="Biləsuvar" />
	<iso_3166_2_entry
		code="AZ-CAB"	name="Cəbrayıl" />
	<iso_3166_2_entry
		code="AZ-CAL"	name="Cəlilabad" />
	<iso_3166_2_entry
		code="AZ-CUL"	name="Culfa"	parent="AZ-NX" />
	<iso_3166_2_entry
		code="AZ-DAS"	name="Daşkəsən" />
	<iso_3166_2_entry
		code="AZ-FUZ"	name="Füzuli" />
	<iso_3166_2_entry
		code="AZ-GAD"	name="Gədəbəy" />
	<iso_3166_2_entry
		code="AZ-GOR"	name="Goranboy" />
	<iso_3166_2_entry
		code="AZ-GOY"	name="Göyçay" />
	<iso_3166_2_entry
		code="AZ-GYG"	name="Göygöl" />
	<iso_3166_2_entry
		code="AZ-HAC"	name="Hacıqabul" />
	<iso_3166_2_entry
		code="AZ-IMI"	name="İmişli" />
	<iso_3166_2_entry
		code="AZ-ISM"	name="İsmayıllı" />
	<iso_3166_2_entry
		code="AZ-KAL"	name="Kəlbəcər" />
	<iso_3166_2_entry
		code="AZ-KAN"	name="Kǝngǝrli"	parent="AZ-NX" />
	<iso_3166_2_entry
		code="AZ-KUR"	name="Kürdəmir" />
	<iso_3166_2_entry
		code="AZ-LAC"	name="Laçın" />
	<iso_3166_2_entry
		code="AZ-LAN"	name="Lənkəran" />
	<iso_3166_2_entry
		code="AZ-LER"	name="Lerik" />
	<iso_3166_2_entry
		code="AZ-MAS"	name="Masallı" />
	<iso_3166_2_entry
		code="AZ-NEF"	name="Neftçala" />
	<iso_3166_2_entry
		code="AZ-OGU"	name="Oğuz" />
	<iso_3166_2_entry
		code="AZ-ORD"	name="Ordubad"	parent="AZ-NX" />
	<iso_3166_2_entry
		code="AZ-QAB"	name="Qəbələ" />
	<iso_3166_2_entry
		code="AZ-QAX"	name="Qax" />
	<iso_3166_2_entry
		code="AZ-QAZ"	name="Qazax" />
	<iso_3166_2_entry
		code="AZ-QBA"	name="Quba" />
	<iso_3166_2_entry
		code="AZ-QBI"	name="Qubadlı" />
	<iso_3166_2_entry
		code="AZ-QOB"	name="Qobustan" />
	<iso_3166_2_entry
		code="AZ-QUS"	name="Qusar" />
	<iso_3166_2_entry
		code="AZ-SAB"	name="Sabirabad" />
	<iso_3166_2_entry
		code="AZ-SAD"	name="Sədərək"	parent="AZ-NX" />
	<iso_3166_2_entry
		code="AZ-SAH"	name="Şahbuz"	parent="AZ-NX" />
	<iso_3166_2_entry
		code="AZ-SAK"	name="Şəki" />
	<iso_3166_2_entry
		code="AZ-SAL"	name="Salyan" />
	<iso_3166_2_entry
		code="AZ-SAR"	name="Şərur"	parent="AZ-NX" />
	<iso_3166_2_entry
		code="AZ-SAT"	name="Saatlı" />
	<iso_3166_2_entry
		code="AZ-SBN"	name="Şabran" />
	<iso_3166_2_entry
		code="AZ-SIY"	name="Siyəzən" />
	<iso_3166_2_entry
		code="AZ-SKR"	name="Şəmkir" />
	<iso_3166_2_entry
		code="AZ-SMI"	name="Şamaxı" />
	<iso_3166_2_entry
		code="AZ-SMX"	name="Samux" />
	<iso_3166_2_entry
		code="AZ-SUS"	name="Şuşa" />
	<iso_3166_2_entry
		code="AZ-TAR"	name="Tərtər" />
	<iso_3166_2_entry
		code="AZ-TOV"	name="Tovuz" />
	<iso_3166_2_entry
		code="AZ-UCA"	name="Ucar" />
	<iso_3166_2_entry
		code="AZ-XAC"	name="Xaçmaz" />
	<iso_3166_2_entry
		code="AZ-XCI"	name="Xocalı" />
	<iso_3166_2_entry
		code="AZ-XIZ"	name="Xızı" />
	<iso_3166_2_entry
		code="AZ-XVD"	name="Xocavənd" />
	<iso_3166_2_entry
		code="AZ-YAR"	name="Yardımlı" />
	<iso_3166_2_entry
		code="AZ-YEV"	name="Yevlax" />
	<iso_3166_2_entry
		code="AZ-ZAN"	name="Zəngilan" />
	<iso_3166_2_entry
		code="AZ-ZAQ"	name="Zaqatala" />
	<iso_3166_2_entry
		code="AZ-ZAR"	name="Zərdab" />
</iso_3166_subset>
</iso_3166_country>
<iso_3166_country code="BA">
<iso_3166_subset type="District with special status">
	<iso_3166_2_entry
		code="BA-BRC"	name="Brčko distrikt" />
</iso_3166_subset>
<iso_3166_subset type="Entity">
	<iso_3166_2_entry
		code="BA-BIH"	name="Federacija Bosne i Hercegovine" />
	<iso_3166_2_entry
		code="BA-SRP"	name="Republika Srpska" />
</iso_3166_subset>
</iso_3166_country>
<iso_3166_country code="BB">
<iso_3166_subset type="Parish">
	<iso_3166_2_entry
		code="BB-01"	name="Christ Church" />
	<iso_3166_2_entry
		code="BB-02"	name="Saint Andrew" />
	<iso_3166_2_entry
		code="BB-03"	name="Saint George" />
	<iso_3166_2_entry
		code="BB-04"	name="Saint James" />
	<iso_3166_2_entry
		code="BB-05"	name="Saint John" />
	<iso_3166_2_entry
		code="BB-06"	name="Saint Joseph" />
	<iso_3166_2_entry
		code="BB-07"	name="Saint Lucy" />
	<iso_3166_2_entry
		code="BB-08"	name="Saint Michael" />
	<iso_3166_2_entry
		code="BB-09"	name="Saint Peter" />
	<iso_3166_2_entry
		code="BB-10"	name="Saint Philip" />
	<iso_3166_2_entry
		code="BB-11"	name="Saint Thomas" />
</iso_3166_subset>
</iso_3166_country>
<iso_3166_country code="BD">
<iso_3166_subset type="District">
	<iso_3166_2_entry
		code="BD-01"	name="Bandarban"	parent="BD-B" />
	<iso_3166_2_entry
		code="BD-02"	name="Barguna"	parent="BD-A" />
	<iso_3166_2_entry
		code="BD-03"	name="Bogura"	parent="BD-E" />
	<iso_3166_2_entry
		code="BD-04"	name="Brahmanbaria"	parent="BD-B" />
	<iso_3166_2_entry
		code="BD-05"	name="Bagerhat"	parent="BD-D" />
	<iso_3166_2_entry
		code="BD-06"	name="Barishal"	parent="BD-A" />
	<iso_3166_2_entry
		code="BD-07"	name="Bhola"	parent="BD-A" />
	<iso_3166_2_entry
		code="BD-08"	name="Cumilla"	parent="BD-B" />
	<iso_3166_2_entry
		code="BD-09"	name="Chandpur"	parent="BD-B" />
	<iso_3166_2_entry
		code="BD-10"	name="Chattogram"	parent="BD-B" />
	<iso_3166_2_entry
		code="BD-11"	name="Cox's Bazar"	parent="BD-B" />
	<iso_3166_2_entry
		code="BD-12"	name="Chuadanga"	parent="BD-D" />
	<iso_3166_2_entry
		code="BD-13"	name="Dhaka"	parent="BD-C" />
	<iso_3166_2_entry
		code="BD-14"	name="Dinajpur"	parent="BD-F" />
	<iso_3166_2_entry
		code="BD-15"	name="Faridpur"	parent="BD-C" />
	<iso_3166_2_entry
		code="BD-16"	name="Feni"	parent="BD-B" />
	<iso_3166_2_entry
		code="BD-17"	name="Gopalganj"	parent="BD-C" />
	<iso_3166_2_entry
		code="BD-18"	name="Gazipur"	parent="BD-C" />
	<iso_3166_2_entry
		code="BD-19"	name="Gaibandha"	parent="BD-F" />
	<iso_3166_2_entry
		code="BD-20"	name="Habiganj"	parent="BD-G" />
	<iso_3166_2_entry
		code="BD-21"	name="Jamalpur"	parent="BD-H" />
	<iso_3166_2_entry
		code="BD-22"	name="Jashore"	parent="BD-D" />
	<iso_3166_2_entry
		code="BD-23"	name="Jhenaidah"	parent="BD-D" />
	<iso_3166_2_entry
		code="BD-24"	name="Joypurhat"	parent="BD-E" />
	<iso_3166_2_entry
		code="BD-25"	name="Jhalakathi"	parent="BD-A" />
	<iso_3166_2_entry
		code="BD-26"	name="Kishoreganj"	parent="BD-C" />
	<iso_3166_2_entry
		code="BD-27"	name="Khulna"	parent="BD-D" />
	<iso_3166_2_entry
		code="BD-28"	name="Kurigram"	parent="BD-F" />
	<iso_3166_2_entry
		code="BD-29"	name="Khagrachhari"	parent="BD-B" />
	<iso_3166_2_entry
		code="BD-30"	name="Kushtia"	parent="BD-D" />
	<iso_3166_2_entry
		code="BD-31"	name="Lakshmipur"	parent="BD-B" />
	<iso_3166_2_entry
		code="BD-32"	name="Lalmonirhat"	parent="BD-F" />
	<iso_3166_2_entry
		code="BD-33"	name="Manikganj"	parent="BD-C" />
	<iso_3166_2_entry
		code="BD-34"	name="Mymensingh"	parent="BD-H" />
	<iso_3166_2_entry
		code="BD-35"	name="Munshiganj"	parent="BD-C" />
	<iso_3166_2_entry
		code="BD-36"	name="Madaripur"	parent="BD-C" />
	<iso_3166_2_entry
		code="BD-37"	name="Magura"	parent="BD-D" />
	<iso_3166_2_entry
		code="BD-38"	name="Moulvibazar"	parent="BD-G" />
	<iso_3166_2_entry
		code="BD-39"	name="Meherpur"	parent="BD-D" />
	<iso_3166_2_entry
		code="BD-40"	name="Narayanganj"	parent="BD-C" />
	<iso_3166_2_entry
		code="BD-41"	name="Netrakona"	parent="BD-H" />
	<iso_3166_2_entry
		code="BD-42"	name="Narsingdi"	parent="BD-C" />
	<iso_3166_2_entry
		code="BD-43"	name="Narail"	parent="BD-D" />
	<iso_3166_2_entry
		code="BD-44"	name="Natore"	parent="BD-E" />
	<iso_3166_2_entry
		code="BD-45"	name="Chapai Nawabganj"	parent="BD-E" />
	<iso_3166_2_entry
		code="BD-46"	name="Nilphamari"	parent="BD-F" />
	<iso_3166_2_entry
		code="BD-47"	name="Noakhali"	parent="BD-B" />
	<iso_3166_2_entry
		code="BD-48"	name="Naogaon"	parent="BD-E" />
	<iso_3166_2_entry
		code="BD-49"	name="Pabna"	parent="BD-E" />
	<iso_3166_2_entry
		code="BD-50"	name="Pirojpur"	parent="BD-A" />
	<iso_3166_2_entry
		code="BD-51"	name="Patuakhali"	parent="BD-A" />
	<iso_3166_2_entry
		code="BD-52"	name="Panchagarh"	parent="BD-F" />
	<iso_3166_2_entry
		code="BD-53"	name="Rajbari"	parent="BD-C" />
	<iso_3166_2_entry
		code="BD-54"	name="Rajshahi"	parent="BD-E" />
	<iso_3166_2_entry
		code="BD-55"	name="Rangpur"	parent="BD-F" />
	<iso_3166_2_entry
		code="BD-56"	name="Rangamati"	parent="BD-B" />
	<iso_3166_2_entry
		code="BD-57"	name="Sherpur"	parent="BD-H" />
	<iso_3166_2_entry
		code="BD-58"	name="Satkhira"	parent="BD-D" />
	<iso_3166_2_entry
		code="BD-59"	name="Sirajganj"	parent="BD-E" />
	<iso_3166_2_entry
		code="BD-60"	name="Sylhet"	parent="BD-G" />
	<iso_3166_2_entry
		code="BD-61"	name="Sunamganj"	parent="BD-G" />
	<iso_3166_2_entry
		code="BD-62"	name="Shariatpur"	parent="BD-C" />
	<iso_3166_2_entry
		code="BD-63"	name="Tangail"	parent="BD-C" />
	<iso_3166_2_entry
		code="BD-64"	name="Thakurgaon"	parent="BD-F" />
</iso_3166_subset>
<iso_3166_subset type="Division">
	<iso_3166_2_entry
		code="BD-A"	name="Barishal" />
	<iso_3166_2_entry
		code="BD-B"	name="Chattogram" />
	<iso_3166_2_entry
		code="BD-C"	name="Dhaka" />
	<iso_3166_2_entry
		code="BD-D"	name="Khulna" />
	<iso_3166_2_entry
		code="BD-E"	name="Rajshahi" />
	<iso_3166_2_entry
		code="BD-F"	name="Rangpur" />
	<iso_3166_2_entry
		code="BD-G"	name="Sylhet" />
	<iso_3166_2_entry
		code="BD-H"	name="Mymensingh" />
</iso_3166_subset>
</iso_3166_country>
<iso_3166_country code="BE">
<iso_3166_subset type="Province">
	<iso_3166_2_entry
		code="BE-VAN"	name="Antwerpen"	parent="BE-VLG" />
	<iso_3166_2_entry
		code="BE-VBR"	name="Vlaams-Brabant"	parent="BE-VLG" />
	<iso_3166_2_entry
		code="BE-VLI"	name="Limburg"	parent="BE-VLG" />
	<iso_3166_2_entry
		code="BE-VOV"	name="Oost-Vlaanderen"	parent="BE-VLG" />
	<iso_3166_2_entry
		code="BE-VWV"	name="West-Vlaanderen"	parent="BE-VLG" />
	<iso_3166_2_entry
		code="BE-WBR"	name="Brabant wallon"	parent="BE-WAL" />
	<iso_3166_2_entry
		code="BE-WHT"	name="Hainaut"	parent="BE-WAL" />
	<iso_3166_2_entry
		code="BE-WLG"	name="Liège"	parent="BE-WAL" />
	<iso_3166_2_entry
		code="BE-WLX"	name="Luxembourg"	parent="BE-WAL" />
	<iso_3166_2_entry
		code="BE-WNA"	name="Namur"	parent="BE-WAL" />
</iso_3166_subset>
<iso_3166_subset type="Region">
	<iso_3166_2_entry
		code="BE-BRU"	name="Bruxelles-Capitale, Région de" />
	<iso_3166_2_entry
		code="BE-VLG"	name="Vlaams Gewest" />
	<iso_3166_2_entry
		code="BE-WAL"	name="wallonne, Région" />
</iso_3166_subset>
</iso_3166_country>
<iso_3166_country code="BF">
<iso_3166_subset type="Province">
	<iso_3166_2_entry
		code="BF-BAL"	name="Balé"	parent="BF-01" />
	<iso_3166_2_entry
		code="BF-BAM"	name="Bam"	parent="BF-05" />
	<iso_3166_2_entry
		code="BF-BAN"	name="Banwa"	parent="BF-01" />
	<iso_3166_2_entry
		code="BF-BAZ"	name="Bazèga"	parent="BF-07" />
	<iso_3166_2_entry
		code="BF-BGR"	name="Bougouriba"	parent="BF-13" />
	<iso_3166_2_entry
		code="BF-BLG"	name="Boulgou"	parent="BF-04" />
	<iso_3166_2_entry
		code="BF-BLK"	name="Boulkiemdé"	parent="BF-06" />
	<iso_3166_2_entry
		code="BF-COM"	name="Comoé"	parent="BF-02" />
	<iso_3166_2_entry
		code="BF-GAN"	name="Ganzourgou"	parent="BF-11" />
	<iso_3166_2_entry
		code="BF-GNA"	name="Gnagna"	parent="BF-08" />
	<iso_3166_2_entry
		code="BF-GOU"	name="Gourma"	parent="BF-08" />
	<iso_3166_2_entry
		code="BF-HOU"	name="Houet"	parent="BF-09" />
	<iso_3166_2_entry
		code="BF-IOB"	name="Ioba"	parent="BF-13" />
	<iso_3166_2_entry
		code="BF-KAD"	name="Kadiogo"	parent="BF-03" />
	<iso_3166_2_entry
		code="BF-KEN"	name="Kénédougou"	parent="BF-09" />
	<iso_3166_2_entry
		code="BF-KMD"	name="Komondjari"	parent="BF-08" />
	<iso_3166_2_entry
		code="BF-KMP"	name="Kompienga"	parent="BF-08" />
	<iso_3166_2_entry
		code="BF-KOP"	name="Koulpélogo"	parent="BF-04" />
	<iso_3166_2_entry
		code="BF-KOS"	name="Kossi"	parent="BF-01" />
	<iso_3166_2_entry
		code="BF-KOT"	name="Kouritenga"	parent="BF-04" />
	<iso_3166_2_entry
		code="BF-KOW"	name="Kourwéogo"	parent="BF-11" />
	<iso_3166_2_entry
		code="BF-LER"	name="Léraba"	parent="BF-02" />
	<iso_3166_2_entry
		code="BF-LOR"	name="Loroum"	parent="BF-10" />
	<iso_3166_2_entry
		code="BF-MOU"	name="Mouhoun"	parent="BF-01" />
	<iso_3166_2_entry
		code="BF-NAM"	name="Namentenga"	parent="BF-05" />
	<iso_3166_2_entry
		code="BF-NAO"	name="Nahouri"	parent="BF-07" />
	<iso_3166_2_entry
		code="BF-NAY"	name="Nayala"	parent="BF-01" />
	<iso_3166_2_entry
		code="BF-NOU"	name="Noumbiel"	parent="BF-13" />
	<iso_3166_2_entry
		code="BF-OUB"	name="Oubritenga"	parent="BF-11" />
	<iso_3166_2_entry
		code="BF-OUD"	name="Oudalan"	parent="BF-12" />
	<iso_3166_2_entry
		code="BF-PAS"	name="Passoré"	parent="BF-10" />
	<iso_3166_2_entry
		code="BF-PON"	name="Poni"	parent="BF-13" />
	<iso_3166_2_entry
		code="BF-SEN"	name="Séno"	parent="BF-12" />
	<iso_3166_2_entry
		code="BF-SIS"	name="Sissili"	parent="BF-06" />
	<iso_3166_2_entry
		code="BF-SMT"	name="Sanmatenga"	parent="BF-05" />
	<iso_3166_2_entry
		code="BF-SNG"	name="Sanguié"	parent="BF-06" />
	<iso_3166_2_entry
		code="BF-SOM"	name="Soum"	parent="BF-12" />
	<iso_3166_2_entry
		code="BF-SOR"	name="Sourou"	parent="BF-01" />
	<iso_3166_2_entry
		code="BF-TAP"	name="Tapoa"	parent="BF-08" />
	<iso_3166_2_entry
		code="BF-TUI"	name="Tuy"	parent="BF-09" />
	<iso_3166_2_entry
		code="BF-YAG"	name="Yagha"	parent="BF-12" />
	<iso_3166_2_entry
		code="BF-YAT"	name="Yatenga"	parent="BF-10" />
	<iso_3166_2_entry
		code="BF-ZIR"	name="Ziro"	parent="BF-06" />
	<iso_3166_2_entry
		code="BF-ZON"	name="Zondoma"	parent="BF-10" />
	<iso_3166_2_entry
		code="BF-ZOU"	name="Zoundwéogo"	parent="BF-07" />
</iso_3166_subset>
<iso_3166_subset type="Region">
	<iso_3166_2_entry
		code="BF-01"	name="Boucle du Mouhoun" />
	<iso_3166_2_entry
		code="BF-02"	name="Cascades" />
	<iso_3166_2_entry
		code="BF-03"	name="Centre" />
	<iso_3166_2_entry
		code="BF-04"	name="Centre-Est" />
	<iso_3166_2_entry
		code="BF-05"	name="Centre-Nord" />
	<iso_3166_2_entry
		code="BF-06"	name="Centre-Ouest" />
	<iso_3166_2_entry
		code="BF-07"	name="Centre-Sud" />
	<iso_3166_2_entry
		code="BF-08"	name="Est" />
	<iso_3166_2_entry
		code="BF-09"	name="Hauts-Bassins" />
	<iso_3166_2_entry
		code="BF-10"	name="Nord" />
	<iso_3166_2_entry
		code="BF-11"	name="Plateau-Central" />
	<iso_3166_2_entry
		code="BF-12"	name="Sahel" />
	<iso_3166_2_entry
		code="BF-13"	name="Sud-Ouest" />
</iso_3166_subset>
</iso_3166_country>
<iso_3166_country code="BG">
<iso_3166_subset type="District">
	<iso_3166_2_entry
		code="BG-01"	name="Blagoevgrad" />
	<iso_3166_2_entry
		code="BG-02"	name="Burgas" />
	<iso_3166_2_entry
		code="BG-03"	name="Varna" />
	<iso_3166_2_entry
		code="BG-04"	name="Veliko Tarnovo" />
	<iso_3166_2_entry
		code="BG-05"	name="Vidin" />
	<iso_3166_2_entry
		code="BG-06"	name="Vratsa" />
	<iso_3166_2_entry
		code="BG-07"	name="Gabrovo" />
	<iso_3166_2_entry
		code="BG-08"	name="Dobrich" />
	<iso_3166_2_entry
		code="BG-09"	name="Kardzhali" />
	<iso_3166_2_entry
		code="BG-10"	name="Kyustendil" />
	<iso_3166_2_entry
		code="BG-11"	name="Lovech" />
	<iso_3166_2_entry
		code="BG-12"	name="Montana" />
	<iso_3166_2_entry
		code="BG-13"	name="Pazardzhik" />
	<iso_3166_2_entry
		code="BG-14"	name="Pernik" />
	<iso_3166_2_entry
		code="BG-15"	name="Pleven" />
	<iso_3166_2_entry
		code="BG-16"	name="Plovdiv" />
	<iso_3166_2_entry
		code="BG-17"	name="Razgrad" />
	<iso_3166_2_entry
		code="BG-18"	name="Ruse" />
	<iso_3166_2_entry
		code="BG-19"	name="Silistra" />
	<iso_3166_2_entry
		code="BG-20"	name="Sliven" />
	<iso_3166_2_entry
		code="BG-21"	name="Smolyan" />
	<iso_3166_2_entry
		code="BG-22"	name="Sofia (stolitsa)" />
	<iso_3166_2_entry
		code="BG-23"	name="Sofia" />
	<iso_3166_2_entry
		code="BG-24"	name="Stara Zagora" />
	<iso_3166_2_entry
		code="BG-25"	name="Targovishte" />
	<iso_3166_2_entry
		code="BG-26"	name="Haskovo" />
	<iso_3166_2_entry
		code="BG-27"	name="Shumen" />
	<iso_3166_2_entry
		code="BG-28"	name="Yambol" />
</iso_3166_subset>
</iso_3166_country>
<iso_3166_country code="BH">
<iso_3166_subset type="Governorate">
	<iso_3166_2_entry
		code="BH-13"	name="Al ‘Āşimah" />
	<iso_3166_2_entry
		code="BH-14"	name="Al Janūbīyah" />
	<iso_3166_2_entry
		code="BH-15"	name="Al Muḩarraq" />
	<iso_3166_2_entry
		code="BH-17"	name="Ash Shamālīyah" />
</iso_3166_subset>
</iso_3166_country>
<iso_3166_country code="BI">
<iso_3166_subset type="Province">
	<iso_3166_2_entry
		code="BI-BB"	name="Bubanza" />
	<iso_3166_2_entry
		code="BI-BL"	name="Bujumbura Rural" />
	<iso_3166_2_entry
		code="BI-BM"	name="Bujumbura Mairie" />
	<iso_3166_2_entry
		code="BI-BR"	name="Bururi" />
	<iso_3166_2_entry
		code="BI-CA"	name="Cankuzo" />
	<iso_3166_2_entry
		code="BI-CI"	name="Cibitoke" />
	<iso_3166_2_entry
		code="BI-GI"	name="Gitega" />
	<iso_3166_2_entry
		code="BI-KI"	name="Kirundo" />
	<iso_3166_2_entry
		code="BI-KR"	name="Karuzi" />
	<iso_3166_2_entry
		code="BI-KY"	name="Kayanza" />
	<iso_3166_2_entry
		code="BI-MA"	name="Makamba" />
	<iso_3166_2_entry
		code="BI-MU"	name="Muramvya" />
	<iso_3166_2_entry
		code="BI-MW"	name="Mwaro" />
	<iso_3166_2_entry
		code="BI-MY"	name="Muyinga" />
	<iso_3166_2_entry
		code="BI-NG"	name="Ngozi" />
	<iso_3166_2_entry
		code="BI-RM"	name="Rumonge" />
	<iso_3166_2_entry
		code="BI-RT"	name="Rutana" />
	<iso_3166_2_entry
		code="BI-RY"	name="Ruyigi" />
</iso_3166_subset>
</iso_3166_country>
<iso_3166_country code="BJ">
<iso_3166_subset type="Department">
	<iso_3166_2_entry
		code="BJ-AK"	name="Atacora" />
	<iso_3166_2_entry
		code="BJ-AL"	name="Alibori" />
	<iso_3166_2_entry
		code="BJ-AQ"	name="Atlantique" />
	<iso_3166_2_entry
		code="BJ-BO"	name="Borgou" />
	<iso_3166_2_entry
		code="BJ-CO"	name="Collines" />
	<iso_3166_2_entry
		code="BJ-DO"	name="Donga" />
	<iso_3166_2_entry
		code="BJ-KO"	name="Couffo" />
	<iso_3166_2_entry
		code="BJ-LI"	name="Littoral" />
	<iso_3166_2_entry
		code="BJ-MO"	name="Mono" />
	<iso_3166_2_entry
		code="BJ-OU"	name="Ouémé" />
	<iso_3166_2_entry
		code="BJ-PL"	name="Plateau" />
	<iso_3166_2_entry
		code="BJ-ZO"	name="Zou" />
</iso_3166_subset>
</iso_3166_country>
<iso_3166_country code="BN">
<iso_3166_subset type="District">